id,actionId,campo,valorAnterior,valorNovo,motivoAlteracao,alteradoPor,solicitacaoAjusteId,createdAt
510008,900409,Descrição,"Sugestão de desenvolvimento da Competência: Realizar o curso “Mentalidade Inovadora” – EV.G (Inovação e Aprendizagem Contínua).Por que fazer: Para desenvolver pensamento criativo e flexibilidade diante de mudanças e demandas variadas.Como fazer: Concluir curso, registrar exemplos aplicáveis e elaborar plano com 3 atitudes para estimular inovação na rotina.Onde fazer: Plataforma EV.G.Como comprovar: Certificado + plano com 3 atitudes práticas.","Sugestão de desenvolvimento da Competência: Realizar o curso “Mentalidade Inovadora” – EV.G (Inovação e Aprendizagem Contínua).

Por que fazer: Para desenvolver pensamento criativo e flexibilidade diante de mudanças e demandas variadas.

Como fazer: Concluir curso, registrar exemplos aplicáveis e elaborar plano com 3 atitudes para estimular inovação na rotina.

Onde fazer: Plataforma EV.G.

Como comprovar: Certificado + plano com 3 atitudes práticas.",,1,,2026-02-05 13:44:37
510009,900409,Prazo,01/02/2026,09/02/2026,,1,,2026-02-05 13:44:38
510010,900407,Descrição,"Sugestão de desenvolvimento da Competência: 
Realizar o curso “Ferramentas Google para o Trabalho” (Ferramentas Digitais para Otimização de Tarefas).

Por que fazer: Para aumentar eficiência no fluxo de trabalho usando Drive, Docs, Planilhas e Agenda.
Como fazer: Concluir o curso EV.org.br e aplicar ferramentas no dia a dia (planilhas, agenda, documentos).

Onde fazer: Fundação Bradesco – EV.org.br.Como comprovar: Certificado + documento com exemplos práticos implementados.","Sugestão de desenvolvimento da Competência: 
Realizar o curso “Ferramentas Google para o Trabalho” (Ferramentas Digitais para Otimização de Tarefas).

Por que fazer: Para aumentar eficiência no fluxo de trabalho usando Drive, Docs, Planilhas e Agenda.

Como fazer: Concluir o curso EV.org.br e aplicar ferramentas no dia a dia (planilhas, agenda, documentos).

Onde fazer: Fundação Bradesco – EV.org.br.Como comprovar: Certificado + documento com exemplos práticos implementados.",,1,,2026-02-05 13:44:58
510011,900408,Descrição,"Sugestão de desenvolvimento da Competência: Ler o livro “Como Fazer Amigos e Influenciar Pessoas” (Comunicação e Relacionamento Interpessoal).Por que fazer: Para fortalecer escuta, empatia e vínculos com diferentes perfis no cotidiano institucional.Como fazer: Ler dois capítulos por semana, registrar princípios aplicáveis e produzir resumo com práticas utilizadas.Onde fazer: Biblioteca Sebrae TO.Como comprovar: Ficha de leitura + resumo final com 3 aplicações práticas.","Sugestão de desenvolvimento da Competência: Ler o livro “Como Fazer Amigos e Influenciar Pessoas” (Comunicação e Relacionamento Interpessoal).

Por que fazer: Para fortalecer escuta, empatia e vínculos com diferentes perfis no cotidiano institucional.

Como fazer: Ler dois capítulos por semana, registrar princípios aplicáveis e produzir resumo com práticas utilizadas.

Onde fazer: Biblioteca Sebrae TO.Como comprovar: Ficha de leitura + resumo final com 3 aplicações práticas.",,1,,2026-02-05 13:47:47
510012,900408,Prazo,02/02/2026,28/02/2026,,1,,2026-02-05 13:47:47
510013,900407,Prazo,01/02/2026,28/02/2026,,1,,2026-02-05 13:48:05
510014,900339,Prazo,31/12/2025,29/05/2026,,1,,2026-02-05 15:42:20
540001,900452,Título,Inteligência Emocional e Autoconhecimento,Desenvolvimento da Inteligência Emocional e Autoconhecimento,,1,,2026-02-06 09:07:42
540002,900452,Descrição,Sugestão de desenvolvimento da Competência: Desenvolver equilíbrio emocional e empatia nas relações institucionais (Inteligência Emocional) – Desenvolver (Treinamento e estudo).Ação 1: curso “Inteligência Emocional” (Fundação Bradesco); aplicar prática diária de autoconsciência por 10 dias com registros.Como comprovar: certificado + diário breve dos 10 dias.Ação 2 (alternativa): ler Inteligência Emocional (Daniel Goleman); registrar conceitos conectados ao cotidiano; aplicar 1 prática por 1 semana e relatar experiência.Como comprovar: resumo da leitura + relato da prática aplicada.,"Detalhes da ação (Descrição da Ação)
O que fazer: Desenvolver inteligência emocional por meio de capacitação formal e práticas de autoconsciência aplicadas ao cotidiano profissional. 

Como fazer: Como primeira alternativa, realizar o curso “Inteligência Emocional”, oferecido pela Fundação Bradesco, e aplicar uma prática diária de autoconsciência durante dez dias consecutivos, registrando percepções, emoções e aprendizados; como alternativa, realizar a leitura do livro Inteligência Emocional, de Daniel Goleman, registrar os principais conceitos conectados ao cotidiano de trabalho, aplicar uma prática relacionada ao conteúdo por uma semana e relatar a experiência vivenciada. 

Onde fazer: Plataforma da Fundação Bradesco ou leitura individual do livro, com aplicação prática no ambiente de trabalho e registros pessoais. 

Como comprovar: Certificado de conclusão do curso acompanhado de diário breve com os registros dos dez dias de prática, quando utilizada a primeira alternativa, ou resumo da leitura acompanhado de relato da prática aplicada, quando utilizada a alternativa de leitura.

",,1,,2026-02-06 09:07:42
540003,900451,Título,"Planejamento, Foco e Resultados",Organização das Entregas com Foco em Resultados,,1,,2026-02-06 09:10:16
540004,900451,Descrição,"Sugestão de desenvolvimento da Competência: Organizar entregas com foco em resultado e controle de prioridades – Desenvolver (Desafio profissional).Ação 1: aplicar GTD (ler A Arte de Fazer Acontecer, listar tarefas, classificar por contexto/prioridade, definir próximas ações, revisar semanalmente).Como comprovar: resumo do livro + exemplo real aplicado na rotina.Ação 2: usar Todoist (criar conta, estruturar projetos, inserir prazos/etiquetas/prioridades, revisar diariamente, avaliar após 2 semanas).Como comprovar: print das listas organizadas + breve relato dos ganhos.","Detalhes da ação (Descrição da Ação)
O que fazer: Desenvolver planejamento e foco em resultados por meio da organização das atividades e do controle estruturado de prioridades na rotina de trabalho. ´

Como fazer: Como primeira alternativa, aplicar a metodologia GTD a partir da leitura do livro A Arte de Fazer Acontecer, listando todas as tarefas, classificando-as por contexto e prioridade, definindo próximas ações e realizando revisões semanais; como segunda alternativa, utilizar a ferramenta Todoist, criando uma conta, estruturando projetos, inserindo prazos, etiquetas e prioridades, realizando revisões diárias e avaliando os ganhos obtidos após duas semanas de uso. 

Onde fazer: Leitura individual e aplicação prática no ambiente de trabalho, com apoio de ferramenta digital de gestão de tarefas, como o Todoist. 

Como comprovar: Resumo do livro acompanhado de exemplo real aplicado na rotina, quando utilizada a primeira alternativa, ou print das listas organizadas no Todoist acompanhado de breve relato dos ganhos percebidos, quando utilizada a segunda alternativa.
",,1,,2026-02-06 09:10:16
540005,900495,Título,"Planejamento, Foco e Resultados",Capacitação em Planejamento e Gestão de Auditorias com Foco em Resultados,,1,,2026-02-06 09:49:38
540006,900495,Descrição,"SugestÃ£o de desenvolvimento da CompetÃªncia: Curso Diligente One â€“ Auditoria (GovernanÃ§a e Auditoria) â€“ Desenvolver (Treinamento e estudo).Objetivo: capacitar no uso do sistema Diligente One, essencial para gestÃ£o institucional de auditorias.Justificativa: fortalece governanÃ§a, cumprimento de normativos e acompanhamento estruturado dos processos de auditoria.Como realizar: participar da capacitaÃ§Ã£o institucional; explorar mÃ³dulos (planejamento, achados, follow-up); realizar simulaÃ§Ãµes completas; produzir guia de uso personalizado.Onde fazer: capacitaÃ§Ã£o interna Sebrae ou com fornecedor Diligent.Como comprovar: certificado + relato tÃ©cnico com evidÃªncia de uso prÃ¡tico.AÃ§Ã£o alternativa (opcional): estudo dirigido com relatÃ³rios tÃ©cnicos de auditorias passadas e elaboraÃ§Ã£o de documento comparativo com sugestÃµes de melhoria.Como comprovar (opcional): entrega do relatÃ³rio comparativo e reflexÃµes.","Detalhes da ação (Descrição da Ação)
O que fazer: Desenvolver competências em planejamento, foco e resultados por meio da capacitação no uso do sistema Diligent One aplicado à gestão institucional de auditorias. 

Como fazer: Participar da capacitação institucional no sistema Diligent One, explorar os módulos de planejamento, registro de achados e follow-up, realizar simulações completas de auditoria e elaborar um guia de uso personalizado; alternativamente, realizar estudo dirigido com base em relatórios técnicos de auditorias anteriores, analisando práticas adotadas e elaborando documento comparativo com sugestões de melhoria. 

Onde fazer: Capacitação interna promovida pelo Sebrae ou treinamento realizado com o fornecedor Diligent. 

Como comprovar: Certificado de participação acompanhado de relato técnico com evidências de uso prático do sistema; quando utilizada a alternativa de estudo dirigido, entrega do relatório comparativo contendo reflexões e sugestões de melhoria.
",,1,,2026-02-06 09:49:38
540009,900495,Título,Capacitação em Planejamento e Gestão de Auditorias com Foco em Resultados,Capacitação no Uso do Sistema Diligent One para Auditoria,,1,,2026-02-06 09:59:08
570001,900528,Prazo,31/03/2026,31/05/2026,,1440001,,2026-02-06 13:25:47
600001,900612,Descrição,"Sugestão de desenvolvimento da Competência: Cursar Legislação para MPEs (Legislação e Direito Administrativo) – Longo prazo.Por que fazer: Para ampliar segurança técnica e conformidade na orientação a micro e pequenas empresas e na atuação com políticas públicas.Como fazer: Estudar leis e regulamentações relacionadas a MPEs (tributária, trabalhista e empresarial); priorizar casos práticos e anotações; assistir aulas com exemplos; resolver casos simulados; participar de fóruns/grupos para troca e fixação.Onde fazer: Curso do Instituto Legislativo Brasileiro (ILB) e leitura de apoio (Cartilha da Lei Geral – Portal Sebrae), ou alternativa equivalente alinhada à liderança/UGP.Como comprovar: Certificado do curso + relatório de aplicação das normas (com exemplos/casos analisados).","Sugestão de desenvolvimento da Competência: Cursar Legislação para MPEs (Legislação e Direito Administrativo) – Longo prazo.

Por que fazer: Para ampliar segurança técnica e conformidade na orientação a micro e pequenas empresas e na atuação com políticas públicas.

Como fazer: Estudar leis e regulamentações relacionadas a MPEs (tributária, trabalhista e empresarial); priorizar casos práticos e anotações; assistir aulas com exemplos; resolver casos simulados; participar de fóruns/grupos para troca e fixação.

Onde fazer: Curso do Instituto Legislativo Brasileiro (ILB) e leitura de apoio (Cartilha da Lei Geral – Portal Sebrae), ou alternativa equivalente alinhada à liderança/UGP.

Como comprovar: Certificado do curso + relatório de aplicação das normas (com exemplos/casos analisados).",,1,,2026-02-06 17:05:37
600002,900577,Descrição,"Sugestão de desenvolvimento da Competência: Compreender e aplicar conceitos de transformação digital (Tecnologia e Inovação).Por que fazer: Para atualizar-se em tendências tecnológicas e otimizar processos e decisões no trabalho.Como fazer: Explorar conceitos de inovação digital, automação e dados, participando de workshops interativos.Onde fazer: Cursos FGV, Insper, Sebrae, MIT Sloan, LinkedIn Learning.Como comprovar: Certificado + relatório de aplicação prática + validação da liderança.","Sugestão de desenvolvimento da Competência: Compreender e aplicar conceitos de transformação digital (Tecnologia e Inovação).

Por que fazer: Para atualizar-se em tendências tecnológicas e otimizar processos e decisões no trabalho.

Como fazer: Explorar conceitos de inovação digital, automação e dados, participando de workshops interativos.

Onde fazer: Cursos FGV, Insper, Sebrae, MIT Sloan, LinkedIn Learning.

Como comprovar: Certificado + relatório de aplicação prática + validação da liderança.",,1,,2026-02-06 17:06:12
600003,900677,Título,"Planejamento, Foco e Resultados",Proposição Estruturada de Melhorias Processuais,,1,,2026-02-06 19:46:20
600004,900677,Descrição,"Sugestão de desenvolvimento da Competência: Propor Melhorias Processuais Trimestralmente (Processos & Qualidade) – Desenvolver (Treinamento e estudo) – Longo Prazo.Objetivo: desenvolver olhar crítico para processos e atuar como agente de melhoria contínua.Justificativa: identificar oportunidades de melhoria demonstra liderança e impacto organizacional.Como realizar: mapear processo recorrente; identificar gargalos; realizar brainstorm com colegas; elaborar proposta executiva com benefícios e métricas projetadas.Onde aprender: Udemy (Gestão de Processos/KPIs/Lean), FDC, palestras sobre performance.Como comprovar: portfólio de melhorias com fluxogramas antes/depois + registros de feedback e brainstorm.","Detalhes da ação (Descrição da Ação)
O que fazer: Propor melhorias processuais de forma estruturada, atuando como agente de melhoria contínua com foco em processos e qualidade. 

Como fazer: Mapear um processo recorrente da rotina de trabalho, identificar gargalos e oportunidades de melhoria, realizar sessões de brainstorm com colegas envolvidos, e elaborar uma proposta executiva contendo descrição das melhorias sugeridas, benefícios esperados e métricas projetadas de resultado. 

Onde fazer: Capacitações e estudos em plataformas como Udemy, Fundação Dom Cabral e participação em palestras ou conteúdos voltados à gestão de processos, indicadores de desempenho e melhoria contínua. 

Como comprovar: Portfólio de melhorias contendo fluxogramas do processo antes e depois das propostas, registros das sessões de brainstorm realizadas e feedbacks recebidos sobre as propostas apresentadas.

",,1,,2026-02-06 19:46:20
600005,900676,Título,Gestão do Conhecimento e Documentação Institucional,Atualização Profissional Contínua e Compartilhamento de Conhecimento,,1,,2026-02-06 19:48:58
600006,900676,Descrição,Sugestão de desenvolvimento da Competência: Realizar Cursos de Atualização e Compartilhar Conhecimentos (Atualização Profissional Contínua) – Desenvolver (Treinamento e estudo) – Longo Prazo.Objetivo: manter aprendizagem contínua e fortalecer influência positiva no time por meio do compartilhamento de conhecimento.Justificativa: profissionais que se atualizam tornam-se referências naturais e ampliam seu valor organizacional.Como realizar: cronograma anual com 3 ciclos; selecionar cursos alinhados à área e competências; aplicar uma técnica semanal; apresentar aprendizados em reuniões curtas; criar resumos visuais e incentivar colegas.Recursos: livro Aprendendo a Aprender (Barbara Oakley); diário de aprendizado; Canva.Como comprovar: portfólio com certificados + registros de compartilhamento + relato de aplicação prática + feedback de colegas.,"Detalhes da ação (Descrição da Ação)
O que fazer: Desenvolver a gestão do conhecimento e a documentação institucional por meio da realização contínua de cursos de atualização e do compartilhamento estruturado dos aprendizados com a equipe. 

Como fazer: Elaborar um cronograma anual dividido em três ciclos de aprendizagem, selecionar cursos alinhados à área de atuação e às competências prioritárias, aplicar semanalmente ao menos uma técnica ou conceito aprendido na rotina de trabalho, apresentar os principais aprendizados em reuniões curtas com o time e produzir resumos visuais para facilitar a disseminação do conhecimento, incentivando a participação dos colegas. 

Onde fazer: Cursos de capacitação alinhados à área de atuação, leitura do livro Aprendendo a Aprender, de Barbara Oakley, uso de diário de aprendizado e ferramentas como Canva para organização e compartilhamento dos conteúdos. 

Como comprovar: Portfólio contendo certificados dos cursos realizados, registros das apresentações ou compartilhamentos efetuados, relato de aplicação prática dos aprendizados e feedbacks recebidos dos colegas.

",,1,,2026-02-06 19:48:58
600008,900453,Descrição,"Sugestão de desenvolvimento da Competência: Participar de MBA em Gestão de Projetos, Liderança ou Agronegócio – Desenvolver (Treinamento e estudo) – Médio Prazo.Ação 1 – Participar de MBA em Gestão de Projetos, Liderança ou AgronegócioJustificativa: Romisson, como ação de médio prazo, o MBA contribuirá de forma significativa para consolidar sua trajetória profissional, aprofundar competências técnicas e ampliar sua visão estratégica no contexto organizacional.Como realizar a ação: elaborar um plano de melhoria com base em um problema ou oportunidade identificado na regional; executar o plano com apoio da equipe, garantindo a aplicação prática dos conhecimentos adquiridos ao longo do curso.Onde fazer: no ambiente da regional, com suporte da coordenação e articulação direta com colegas da equipe (alinhado com a liderança).Material de apoio: pesquisar curso preferencialmente na Universidade Sebrae e Degreed; artigos e livros técnicos; podcasts e vídeos de especialistas.Como comprovar: certificado de matrícula e/ou conclusão do MBA; relatório reflexivo sobre a aplicação prática; plano finalizado com resultados observados; apresentação oral ou escrita destacando impactos gerados na regional.","Sugestão de desenvolvimento da Competência: 
Participar de MBA em Gestão de Projetos, Liderança ou Agronegócio – Desenvolver (Treinamento e estudo) – Médio Prazo.Ação 1 – Participar de MBA em Gestão de Projetos, Liderança ou AgronegócioJustificativa: Romisson, como ação de médio prazo, o MBA contribuirá de forma significativa para consolidar sua trajetória profissional, aprofundar competências técnicas e ampliar sua visão estratégica no contexto organizacional.

Como realizar a ação:
elaborar um plano de melhoria com base em um problema ou oportunidade identificado na regional; executar o plano com apoio da equipe, garantindo a aplicação prática dos conhecimentos adquiridos ao longo do curso.

Onde fazer:
 no ambiente da regional, com suporte da coordenação e articulação direta com colegas da equipe (alinhado com a liderança).Material de apoio: pesquisar curso preferencialmente na Universidade Sebrae e Degreed; artigos e livros técnicos; podcasts e vídeos de especialistas.

Como comprovar: certificado de matrícula e/ou conclusão do MBA; relatório reflexivo sobre a aplicação prática; plano finalizado com resultados observados; apresentação oral ou escrita destacando impactos gerados na regional.",,1,,2026-02-06 19:53:36
600009,900422,Descrição,"Sugestão de desenvolvimento da Competência: Participar da Feira do Empreendedor e do EMPRETEC (Protagonismo Colaborativo).Por que fazer: Para desenvolver visão mais ampla e estratégica sobre o universo do empreendedorismo, com contato direto com empreendedores, conteúdos atualizados e trocas práticas de experiência.Como fazer: Inscrever-se nos eventos; participar ativamente de oficinas, palestras e mentorias; registrar aprendizados em bloco de notas ou planner; elaborar relatório reflexivo com ideias e contatos realizados.Onde fazer: Feira do Empreendedor (presencial ou online pelo Sebrae) e EMPRETEC (curso presencial com inscrições regionais).Como comprovar: Relatório reflexivo individual + certificados ou declarações de participação + fotos ou capturas de tela comprovando presença.","Sugestão de desenvolvimento da Competência: Participar da Feira do Empreendedor e do EMPRETEC (Protagonismo Colaborativo).

Por que fazer: Para desenvolver visão mais ampla e estratégica sobre o universo do empreendedorismo, com contato direto com empreendedores, conteúdos atualizados e trocas práticas de experiência.

Como fazer: Inscrever-se nos eventos; participar ativamente de oficinas, palestras e mentorias; registrar aprendizados em bloco de notas ou planner; elaborar relatório reflexivo com ideias e contatos realizados.

Onde fazer: Feira do Empreendedor (presencial ou online pelo Sebrae) e EMPRETEC (curso presencial com inscrições regionais).

Como comprovar: Relatório reflexivo individual + certificados ou declarações de participação + fotos ou capturas de tela comprovando presença.",,1,,2026-02-06 19:54:05
600010,900531,Título,Presença Executiva,Atuação Protagonista com Foco em Presença Executiva,,1,,2026-02-06 19:55:35
600011,900531,Descrição,"- Qual a sugestão do que se deve fazer: Assumir protagonismo propondo melhorias internas na regional. - Por que fazer: Para fortalecer atuação protagonista, influenciar positivamente o ambiente de trabalho e gerar mudanças estratégicas que beneficiem equipe e organização. - Como se deve fazer: Identificar oportunidade de melhoria; desenhar proposta prática e viável; apresentar à gestão com benefícios; acompanhar implementação, ajustar e monitorar resultados; usar ferramentas (SWOT, matriz de priorização, Canvas/mapa de processos, KPIs). - Onde se pode fazer (quais as sugestões): Na regional (processos/práticas internas); apoio por cursos internos, workshops do Sebrae e mentoria/consultoria interna. - Como comprovar que fez: Proposta formal apresentada (benefícios, metas, indicadores) + relato da aplicação (passos, feedbacks, ajustes) + resultados obtidos medidos por indicadores/impacto."," Detalhes da ação (Descrição da Ação)
O que fazer: Assumir protagonismo propondo melhorias internas na regional, fortalecendo a presença executiva e a postura profissional. 

Como fazer: Identificar oportunidades de melhoria em processos ou práticas internas, estruturar uma proposta prática e viável, apresentar a proposta à gestão destacando benefícios, metas e indicadores, acompanhar a implementação, realizar ajustes quando necessário e monitorar os resultados alcançados, utilizando ferramentas como análise SWOT, matriz de priorização, Canvas ou mapeamento de processos e definição de KPIs. 

Onde fazer: No ambiente da regional, por meio da análise de processos e práticas internas, com apoio de cursos internos, workshops do Sebrae e, quando aplicável, mentoria ou consultoria interna. 

Como comprovar: Proposta formal apresentada contendo benefícios, metas e indicadores, acompanhada de relato da aplicação com registro dos passos realizados, feedbacks recebidos, ajustes efetuados e resultados obtidos mensurados por indicadores ou impacto gerado.
",,1,,2026-02-06 19:55:35
600012,900530,Título,"Tecnologia, Dados e Transformação Digital",Análise e Visualização de Dados com Power BI para Apoio à Decisão,,1,,2026-02-06 19:58:08
600013,900530,Descrição,"- Qual a sugestão do que se deve fazer: Aprimorar a capacidade de análise e apresentação de dados para decisões públicas (curso de Power BI + prática). - Por que fazer: Para melhorar clareza e qualidade de relatórios técnicos e apoiar decisões informadas no setor público, otimizando processos e embasando decisões estratégicas. - Como se deve fazer: Fazer curso prático de Power BI; criar dashboards interativos com dados públicos; desenvolver relatórios técnicos baseados nas análises; apresentar dashboard e relatório em reunião interna/gestão explicando decisões tomadas com base nos dados. - Onde se pode fazer (quais as sugestões): Fundação Bradesco (EV) e Escola Virtual Gov; outras opções de Power BI e dados públicos. - Como comprovar que fez: Certificado do curso + dashboard produzido + relato de aplicação prática (como foi usado para apoiar decisão).","Detalhes da ação (Descrição da Ação)

O que fazer: Aprimorar a capacidade de análise e apresentação de dados para apoiar decisões no setor público por meio do uso de ferramentas de business intelligence. 

Como fazer: Realizar curso prático de Power BI, desenvolver dashboards interativos utilizando dados públicos, elaborar relatórios técnicos baseados nas análises realizadas e apresentar os dashboards e relatórios em reunião interna ou para a gestão, explicando como os dados embasaram decisões ou recomendações estratégicas. 

Onde fazer: Cursos oferecidos pela Fundação Bradesco (Escola Virtual), Escola Virtual Gov e outras plataformas de capacitação em Power BI e análise de dados públicos. 

Como comprovar: Certificado de conclusão do curso acompanhado do dashboard produzido e de relato da aplicação prática, descrevendo como a análise de dados foi utilizada para apoiar decisões.

",,1,,2026-02-06 19:58:08
600014,1140026,Título,Guia de bolso dos processos principais,[Onboarding] Guia de bolso dos processos principais,,1,,2026-02-06 20:03:52
600015,1140025,Título,Leitura do Código de Ética e Uso da Marca + mini resumo,[Onboarding] Leitura do Código de Ética e Uso da Marca + mini resumo,,1,,2026-02-06 20:04:02
600016,1140024,Título,"Prática: ""1 meta, 1 motivo"" por semana","[Onboarding] Prática: ""1 meta, 1 motivo"" por semana",,1,,2026-02-06 20:04:15
600017,900551,Status,concluida,em_andamento,,1,,2026-02-06 20:25:53
630001,900529,Título,Comunicação Estratégica e Influente,Desenvolvimento da Comunicação Estratégica e Influente,,1,,2026-02-07 00:53:04
