id,actionId,campo,valorAnterior,valorNovo,motivoAlteracao,alteradoPor,solicitacaoAjusteId,createdAt
900003,900524,Descrição,"- Qual a sugestão do que se deve fazer: Participar de pelo menos uma ação do Programa do BEM/Visão de Futuro. - Por que fazer: Por ser ação obrigatória do plano e para fortalecer soft skills (empatia, visão estratégica, adaptabilidade, comunicação etc.) evidenciando compromisso com evolução contínua. - Como se deve fazer: Acessar plataforma; escolher trilha/módulo/desafio; realizar atividade (vídeo/podcast/leitura/reflexão); finalizar conforme instruções; registrar participação (print/comprovante); compartilhar/registrar se solicitado. - Onde se pode fazer (quais as sugestões): Plataforma do BEM / Visão de Futuro (100% online, via navegador, em qualquer dispositivo). - Como comprovar que fez: Print da atividade ou certificado + relato breve do que aprendeu/praticou.","- Qual a sugestão do que se deve fazer: Participar de pelo menos uma ação do Programa do BEM/Visão de Futuro.

Por que fazer: Por ser ação obrigatória do plano e para fortalecer soft skills (empatia, visão estratégica, adaptabilidade, comunicação etc.) evidenciando compromisso com evolução contínua.

Como se deve fazer: Acessar plataforma; escolher trilha/módulo/desafio; realizar atividade (vídeo/podcast/leitura/reflexão); finalizar conforme instruções; registrar participação (print/comprovante); compartilhar/registrar se solicitado. 

Onde se pode fazer (quais as sugestões): Plataforma do BEM / Visão de Futuro (100% online, via navegador, em qualquer dispositivo). 

Como comprovar que fez: Print da atividade ou certificado + relato breve do que aprendeu/praticou.",,1,,2026-02-14 22:18:03
900004,1140027,Descrição,"Como fazer:

https://www.escolavirtual.gov.br/curso/372
Ao longo do curso, anote pelo menos 3 técnicas que façam sentido para o seu dia a dia. Pode ser: como fazer perguntas que revelam necessidades, como responder objeções de forma positiva, ou como propor próximos passos de maneira natural.
Depois, escolha 1 dessas técnicas e aplique em uma reunião real.
O que entregar: certificado do curso + uma reflexão escrita (1 página) com:

as 3 técnicas que você aprendeu;
qual delas testou em uma conversa real;
o que deu certo e o que pode melhorar.
","Como fazer:
Acessar o curso disponível na Escola Virtual de Governo pelo link: https://www.escolavirtual.gov.br/curso/372
.
Ao longo do curso, anotar pelo menos 3 técnicas aplicáveis ao dia a dia profissional, como por exemplo:

Como fazer perguntas que revelam necessidades;

Como responder objeções de forma positiva;

Como propor próximos passos de maneira natural.

Após concluir o curso, selecionar 1 das técnicas aprendidas e aplicá-la em uma reunião ou conversa real de trabalho. Registrar a experiência de aplicação, observando os resultados obtidos.

Onde fazer:
Plataforma Escola Virtual de Governo (EV.G) + aplicação prática em reunião ou conversa real no ambiente de trabalho.

Como comprovar:
Certificado de conclusão do curso + reflexão escrita (mínimo 1 página) contendo:

As 3 técnicas aprendidas;

Qual técnica foi aplicada na prática;

O que funcionou bem;

Pontos de melhoria identificados na aplicação.
",,1,,2026-02-14 22:26:38
900005,1140028,Descrição,"Como fazer:

Assista ao TED Talk da Amy Cuddy: ""Your Body Language Shapes Who You Are"" (tem legendas em português) e o vídeo Checklist da Presença Executiva, do canal Posicione-se: https://www.youtube.com/watch?v=g7Ea8I572x4
Enquanto assiste, anote pelo menos 3 ideias práticas que você pode aplicar em sua postura (ex.: como se posicionar na cadeira, como usar pausas, como transmitir confiança sem parecer arrogante).
Escreva uma reflexão de 1 página: O que aprendi? O que mudou na minha forma de me portar? O que quero manter como hábito?
O que entregar: link do TED Talk + reflexão de 1 página.

","Como fazer:
Assistir ao TED Talk de Amy Cuddy: “Your Body Language Shapes Who You Are” (disponível com legendas em português) e ao vídeo “Checklist da Presença Executiva”, do canal Posicione-se: https://www.youtube.com/watch?v=g7Ea8I572x4

Durante a visualização dos conteúdos, anotar pelo menos 3 ideias práticas aplicáveis à postura profissional, como por exemplo:

Forma de se posicionar na cadeira;

Uso consciente de pausas na fala;

Como transmitir confiança sem parecer arrogante;

Contato visual e linguagem corporal alinhada ao discurso.

Após assistir aos dois conteúdos, elaborar uma reflexão escrita (mínimo 1 página) respondendo:

O que aprendi?

O que mudou na minha forma de me portar?

O que quero manter como hábito a partir de agora?

Onde fazer:
YouTube (TED Talk e vídeo indicado) + reflexão escrita em Word, Google Docs ou outro editor de texto.

Como comprovar:
Envio do link do TED Talk assistido + reflexão escrita (1 página) com os aprendizados e mudanças práticas identificadas.

",,1,,2026-02-14 22:28:04
900006,1140029,Descrição,"Como fazer:

Pense em 5 perguntas difíceis ou delicadas que podem aparecer em reuniões (por exemplo: sobre prazos, custos, limitações ou críticas).
Escreva respostas de até 3 linhas cada, sempre objetivas, respeitosas e claras.
Grave um áudio de até 3 minutos lendo essas respostas em voz alta.
O que entregar: documento com as 5 perguntas e respostas + 1 áudio de até 3 minutos.

","Como fazer:
Refletir sobre situações reais do seu contexto profissional e elaborar 5 perguntas difíceis ou delicadas que podem surgir em reuniões (ex.: questionamentos sobre prazos, custos, limitações técnicas, críticas à execução ou mudanças de escopo).

Para cada pergunta, escrever uma resposta objetiva, clara e respeitosa, com no máximo 3 linhas, priorizando:

Transparência na informação;

Postura profissional e segura;

Foco em solução ou próximo passo;

Linguagem assertiva, sem justificativas excessivas.

Após estruturar as respostas, gravar um áudio de até 3 minutos lendo todas em voz alta, treinando:

Tom de voz firme e equilibrado;

Ritmo adequado (sem pressa);

Clareza na dicção;

Segurança na entrega da mensagem.

Onde fazer:
Elaboração do documento em Word, Google Docs ou similar + gravação de áudio pelo celular ou computador, em ambiente silencioso.

Como comprovar:
Entrega de:

Documento contendo as 5 perguntas e respectivas respostas;

1 áudio de até 3 minutos com a leitura das respostas em voz alta.",,1,,2026-02-14 22:29:27
930001,900423,Descrição,"Sugestão de desenvolvimento da Competência: Implementar um Painel de Indicadores Regionais com foco em resultados (Protagonismo Colaborativo).Por que fazer: Para fortalecer cultura de resultados e permitir acompanhamento mais objetivo do desempenho regional, facilitando comunicação clara dos avanços com equipe e stakeholders.Como fazer: Mapear indicadores estratégicos; definir fontes e frequência de atualização; montar painel visual em ferramenta de BI; validar com gestores; apresentar periodicamente em reuniões para análise e tomada de decisão.Onde fazer: Power BI, Google Sheets ou Excel; sistemas internos do Sebrae; ambientes de reunião para validação e apresentação.Como comprovar: Capturas de tela ou link do painel + registro de apresentação em reunião + relatório síntese descrevendo indicadores e metodologia adotada.","O que fazer:
Implementar um Painel de Indicadores Regionais com foco em resultados, estruturando acompanhamento sistemático dos principais indicadores estratégicos da regional.

Por que fazer:
Para fortalecer a cultura de resultados, ampliar a visão estratégica sobre o desempenho regional e permitir comunicação clara, objetiva e baseada em dados junto à equipe e stakeholders, apoiando decisões mais assertivas.

Como fazer:
Mapear os indicadores estratégicos prioritários da regional (metas, entregas, impacto, desempenho).
Definir as fontes de dados e a frequência de atualização de cada indicador.
Estruturar um painel visual utilizando ferramenta adequada (Power BI, Google Sheets ou Excel), organizando informações de forma clara e intuitiva.
Validar os indicadores e a estrutura do painel com os gestores responsáveis.
Apresentar periodicamente o painel em reuniões, promovendo análise crítica dos resultados e definição de próximos passos.

Onde fazer:
Ferramentas como Power BI, Google Sheets ou Excel; sistemas internos do Sebrae para coleta de dados; reuniões presenciais ou virtuais para validação e apresentação dos resultados.

Como comprovar:
Capturas de tela ou link do painel implementado + registro de apresentação em reunião (ata, print ou confirmação) + relatório síntese descrevendo os indicadores utilizados, metodologia adotada e principais aprendizados.",,1,,2026-02-14 23:21:39
960001,900685,Descrição,"- Qual a sugestão do que se deve fazer: Criar proposta de melhoria baseada em feedbacks recebidos sobre o próprio trabalho. - Por que fazer: Para desenvolver inovação e criatividade aplicadas ao contexto real, transformando observações em melhorias concretas. - Como se deve fazer: Escolher atividade recorrente, coletar ao menos 3 feedbacks, identificar padrão de melhoria e elaborar proposta prática para validação da liderança. - Onde se pode fazer (quais as sugestões): Portal Sebrae (curso “Criatividade”); apoio com TED Talks e conteúdos do YouTube. - Como comprovar que fez: Documento com feedbacks resumidos, proposta criada e registro do retorno da liderança.","- Qual a sugestão do que se deve fazer: Criar proposta de melhoria baseada em feedbacks recebidos sobre o próprio trabalho. - 

Por que fazer: Para desenvolver inovação e criatividade aplicadas ao contexto real, transformando observações em melhorias concretas. 

- Como se deve fazer: Escolher atividade recorrente, coletar ao menos 3 feedbacks, identificar padrão de melhoria e elaborar proposta prática para validação da liderança. - 

Onde se pode fazer (quais as sugestões): Portal Sebrae (curso “Criatividade”); apoio com TED Talks e conteúdos do YouTube. 

- Como comprovar que fez: Documento com feedbacks resumidos, proposta criada e registro do retorno da liderança.",,1,,2026-02-16 15:57:50
960002,900684,Descrição,"- Qual a sugestão do que se deve fazer: Liderar entrega de projeto prioritário com metas SMART e indicadores estratégicos. - Por que fazer: Para reforçar protagonismo, foco em resultados e alinhamento com objetivos estratégicos da organização. - Como se deve fazer: Escolher projeto com gestor, definir metas SMART, conduzir execução e monitoramento usando ferramentas de gestão de projetos. - Onde se pode fazer (quais as sugestões): FEBRACIS; Fundação Vanzolini; ESPM; Petra Cursos (liderança e resultados). - Como comprovar que fez: Plano de metas SMART, cronograma e entrega registrada do projeto com resultados alcançados.","- Qual a sugestão do que se deve fazer: Liderar entrega de projeto prioritário com metas SMART e indicadores estratégicos. 

- Por que fazer: Para reforçar protagonismo, foco em resultados e alinhamento com objetivos estratégicos da organização.

 - Como se deve fazer: Escolher projeto com gestor, definir metas SMART, conduzir execução e monitoramento usando ferramentas de gestão de projetos. 

- Onde se pode fazer (quais as sugestões): FEBRACIS; Fundação Vanzolini; ESPM; Petra Cursos (liderança e resultados). 

- Como comprovar que fez: Plano de metas SMART, cronograma e entrega registrada do projeto com resultados alcançados.",,1,,2026-02-16 15:58:24
990003,900345,Prazo,31/03/2026,30/05/2026,,1,,2026-02-23 14:50:43
990004,900346,Prazo,31/03/2026,30/04/2026,,1,,2026-02-23 14:51:04
990005,900348,Prazo,31/03/2026,30/04/2026,,1,,2026-02-23 14:51:25
990006,900350,Prazo,31/03/2026,30/04/2026,,1,,2026-02-23 14:51:39
990007,900351,Prazo,31/03/2026,30/04/2026,,1,,2026-02-23 14:51:54
990008,900344,Prazo,31/03/2026,30/05/2026,,1,,2026-02-23 14:52:49
990009,900677,Prazo,31/03/2026,30/05/2026,,1,,2026-02-23 14:53:26
990010,900676,Prazo,31/03/2026,30/05/2026,,1,,2026-02-23 14:53:55
990011,900527,Prazo,31/03/2026,29/04/2026,,1,,2026-02-23 14:56:14
1020001,900688,Descrição,"Sugestão de desenvolvimento da Competência: Realizar o curso “Comunicação Escrita” da Fundação Bradesco (Comunicação Escrita Profissional).Por que fazer: Para aprimorar clareza, coesão e coerência em textos profissionais (relatórios, pareceres e e-mails), aumentando consistência técnica e impacto institucional.Como fazer: Acessar o curso; concluir módulos (ortografia, estrutura textual e técnicas de clareza); após cada módulo elaborar um texto técnico aplicando a técnica; revisar textos com base em coesão/coerência e formalidade.Onde fazer: Plataforma Fundação Bradesco (online) + aplicação no ambiente de trabalho/estudo.Como comprovar: Certificado + exemplo de texto técnico/institucional revisado com base nas técnicas aprendidas.","Sugestão de desenvolvimento da Competência: Realizar o curso “Comunicação Escrita” da Fundação Bradesco (Comunicação Escrita Profissional).

Por que fazer: Para aprimorar clareza, coesão e coerência em textos profissionais (relatórios, pareceres e e-mails), aumentando consistência técnica e impacto institucional.

Como fazer: Acessar o curso; concluir módulos (ortografia, estrutura textual e técnicas de clareza); após cada módulo elaborar um texto técnico aplicando a técnica; revisar textos com base em coesão/coerência e formalidade.

Onde fazer: Plataforma Fundação Bradesco (online) + aplicação no ambiente de trabalho/estudo.

Como comprovar: Certificado + exemplo de texto técnico/institucional revisado com base nas técnicas aprendidas.",,1,,2026-02-23 21:10:08
1020003,900686,Descrição,"Sugestão de desenvolvimento da Competência: Realizar treinamento online do Sistema de Gestão e Execução de Auditoria – Diligent One (Governança e Auditoria).Por que fazer: Para aprofundar conhecimento técnico em estruturas e ferramentas de governança e auditoria, fortalecendo conformidade, gestão de riscos e integridade institucional.Como fazer: Participar do treinamento online do sistema Diligent One, concluindo os módulos orientados e registrando aprendizados aplicáveis à rotina de auditoria.Onde fazer: Online (plataforma do treinamento do Diligent One).Como comprovar: Certificado/declaração de participação ou evidência de conclusão dos módulos (print/registro).","Sugestão de desenvolvimento da Competência: Realizar treinamento online do Sistema de Gestão e Execução de Auditoria – Diligent One (Governança e Auditoria).

Por que fazer: Para aprofundar conhecimento técnico em estruturas e ferramentas de governança e auditoria, fortalecendo conformidade, gestão de riscos e integridade institucional.

Como fazer: Participar do treinamento online do sistema Diligent One, concluindo os módulos orientados e registrando aprendizados aplicáveis à rotina de auditoria.

Onde fazer: Online (plataforma do treinamento do Diligent One).

Como comprovar: Certificado/declaração de participação ou evidência de conclusão dos módulos (print/registro).",,1,,2026-02-23 21:11:03
1050001,900540,Título,Inteligência Emocional e Autoconhecimento,Curso “Escuta Ativa e Diagnóstica 2025” – Universidade Sebrae,,1,,2026-02-26 16:35:55
1050002,900540,Descrição,"- Qual a sugestão do que se deve fazer: Curso “Emoções no Trabalho: como gerenciá-las” – UC Sebrae (Ação 1). - Por que fazer: Porque DISC indica alta sensibilidade e busca por aprovação, podendo gerar maior impacto emocional em pressão ou conflito; ação fortalece autorregulação emocional. - Como se deve fazer: Acessar curso na Universidade Sebrae/Degreed; concluir módulos; registrar aprendizados; aplicar 3 estratégias em situações reais e observar efeitos. - Onde se pode fazer (quais as sugestões): Plataforma UC Sebrae ou Degreed. - Como comprovar que fez: Certificado + relatório das estratégias aplicadas e efeitos percebidos, validado pela liderança.","Por que fazer:
O curso de Escuta Ativa e Diagnóstica contribui diretamente para o fortalecimento da inteligência emocional, pois desenvolve a capacidade de ouvir com presença, interpretar contextos com mais objetividade e separar fatos de interpretações pessoais.
Ao aprimorar a escuta qualificada, o colaborador reduz reações impulsivas, amplia a compreensão do outro e fortalece sua autorregulação emocional — especialmente em situações de conflito, tensão ou cobrança por resultados.

Como se deve fazer:
- Acessar a Universidade Sebrae (UC Sebrae) ou Degreed.
- Localizar o curso “Escuta Ativa e Diagnóstica”.
- Concluir todos os módulos e atividades propostas.
- Durante o curso, registrar pelo menos 3 aprendizados-chave relacionados a:
1. Autorregulação emocional
2. Comunicação em situações difíceis
3. Interpretação mais objetiva de falas e comportamentos
- Aplicar intencionalmente pelo menos 3 técnicas aprendidas (ex.: escuta sem interrupção, perguntas diagnósticas, validação de entendimento) em situações reais de trabalho.
- Observar e registrar os efeitos percebidos na própria reação emocional e na qualidade da interação.

Onde se pode fazer (quais as sugestões):
Plataforma Universidade Sebrae (UC Sebrae) ou Degreed.

Como comprovar que fez:
- Certificado de conclusão do curso.
- ou Relatório breve (1 a 2 páginas) descrevendo:
1. As 3 técnicas aplicadas
2. As situações em que foram utilizadas
3. Os efeitos percebidos na sua gestão emocional
",,1,,2026-02-26 16:35:55
1050003,900544,Descrição,- Qual a sugestão do que se deve fazer: Curso “LGPD para Organizações Públicas” – ENAP (Ação 1). - Por que fazer: Porque atua com dados sensíveis e a formação em LGPD é imprescindível para garantir conformidade e segurança jurídica na UTIC. - Como se deve fazer: Acessar ENAP; concluir curso; registrar 5 pontos críticos para UTIC; compartilhar plano de atenção aos riscos com liderança. - Onde se pode fazer (quais as sugestões): Plataforma Escola Virtual.Gov (ENAP). - Como comprovar que fez: Certificado + plano de atenção aos riscos validado pelo gestor.,"Qual a sugestão do que se deve fazer:
Curso LGPD para Gestão Pública – Portal Sebrae


Por que fazer:
A área atua com contratos, fornecedores, sistemas e informações que envolvem dados pessoais, inclusive dados sensíveis. A formação em LGPD aplicada à gestão pública é essencial para garantir conformidade legal, reduzir riscos e assegurar segurança jurídica nas rotinas da UTIC. Também fortalece a tomada de decisão responsável e a proteção institucional.

Como se deve fazer:
1. Acessar o link do curso no Portal Sebrae
2. Realizar cadastro, se necessário
3. Concluir todos os módulos e atividades
4. Registrar pelo menos 5 pontos críticos que impactam a rotina de Compras, Facilities e Gestão Contratual, como cláusulas contratuais, compartilhamento de dados com fornecedores, armazenamento, descarte de documentos e controle de acessos
5. Elaborar um plano simples de atenção aos riscos identificados, descrevendo vulnerabilidades, possíveis impactos e medidas preventivas aplicáveis à UTIC
6. Compartilhar o plano com a liderança para validação

Onde se pode fazer:
Portal Sebrae – Cursos Online
Link: https://sebrae.com.br/sites/PortalSebrae/cursosonline/lgpd-para-gestao-publica,61a37a2454ed7810VgnVCM1000001b00320aRCRD

Como comprovar que fez:
Certificado de conclusão do curso + documento com o plano de atenção aos riscos validado pelo gestor",,1,,2026-02-26 16:40:40
1050004,900544,Descrição,"Qual a sugestão do que se deve fazer:
Curso LGPD para Gestão Pública – Portal Sebrae


Por que fazer:
A área atua com contratos, fornecedores, sistemas e informações que envolvem dados pessoais, inclusive dados sensíveis. A formação em LGPD aplicada à gestão pública é essencial para garantir conformidade legal, reduzir riscos e assegurar segurança jurídica nas rotinas da UTIC. Também fortalece a tomada de decisão responsável e a proteção institucional.

Como se deve fazer:
1. Acessar o link do curso no Portal Sebrae
2. Realizar cadastro, se necessário
3. Concluir todos os módulos e atividades
4. Registrar pelo menos 5 pontos críticos que impactam a rotina de Compras, Facilities e Gestão Contratual, como cláusulas contratuais, compartilhamento de dados com fornecedores, armazenamento, descarte de documentos e controle de acessos
5. Elaborar um plano simples de atenção aos riscos identificados, descrevendo vulnerabilidades, possíveis impactos e medidas preventivas aplicáveis à UTIC
6. Compartilhar o plano com a liderança para validação

Onde se pode fazer:
Portal Sebrae – Cursos Online
Link: https://sebrae.com.br/sites/PortalSebrae/cursosonline/lgpd-para-gestao-publica,61a37a2454ed7810VgnVCM1000001b00320aRCRD

Como comprovar que fez:
Certificado de conclusão do curso + documento com o plano de atenção aos riscos validado pelo gestor","Qual a sugestão do que se deve fazer:
Curso LGPD para Gestão Pública – Portal Sebrae

Por que fazer:
A área atua com contratos, fornecedores, sistemas e informações que envolvem dados pessoais, inclusive dados sensíveis. A formação em LGPD aplicada à gestão pública é essencial para garantir conformidade legal, reduzir riscos e assegurar segurança jurídica nas rotinas da UTIC. Também fortalece a tomada de decisão responsável e a proteção institucional.

Como se deve fazer:
1 Acessar o link do curso no Portal Sebrae
2 Realizar cadastro, se necessário
3 Concluir todos os módulos e atividades
4 Registrar pelo menos 5 pontos críticos que impactam a rotina de Compras, Facilities e Gestão Contratual, como cláusulas contratuais, compartilhamento de dados com fornecedores, armazenamento, descarte de documentos e controle de acessos
5 Elaborar um plano simples de atenção aos riscos identificados, descrevendo vulnerabilidades, possíveis impactos e medidas preventivas aplicáveis à UTIC
6 Compartilhar o plano com a liderança para validação

Onde se pode fazer:
Portal Sebrae – Cursos Online
Link: https://sebrae.com.br/sites/PortalSebrae/cursosonline/lgpd-para-gestao-publica,61a37a2454ed7810VgnVCM1000001b00320aRCRD

Como comprovar que fez:
Certificado de conclusão do curso + documento com o plano de atenção aos riscos validado pelo gestor",,1,,2026-02-26 16:40:59
1050005,900544,Título,"Compras, Facilities e Gestão Contratual","LGPD para Gestão Pública aplicada a Compras, Facilities e Gestão Contratual",,1,,2026-02-26 16:41:25
1050006,900542,Título,Gestão de Tempo,Seja Mestre na Gestão do Seu Tempo aplicado à Rotina Técnica,,1,,2026-02-26 16:43:54
1050007,900542,Descrição,"- Qual a sugestão do que se deve fazer: Curso “Gestão de tempo para trabalhadores remotos” – UC Sebrae (Ação 1). - Por que fazer: Porque apresenta técnicas práticas para priorização e planejamento eficaz da rotina técnica, reduzindo urgências e melhorando cumprimento de prazos. - Como se deve fazer: Acessar UC Sebrae; concluir curso; aplicar técnica estudada (Eisenhower, 5W2H); compartilhar impactos após 15 dias. - Onde se pode fazer (quais as sugestões): Plataforma UC Sebrae. - Como comprovar que fez: Certificado + relatório com práticas adotadas e resultados percebidos, validado pela liderança.","Qual a sugestão do que se deve fazer:
Curso Seja mestre na gestão do seu tempo – Portal Sebrae
Link: https://sebrae.com.br/sites/PortalSebrae/cursosonline/seja-mestre-na-gestao-do-seu-tempo,91746ebcebcaf710VgnVCM100000d701210aRCRD

Por que fazer:
O curso apresenta técnicas práticas para priorização, organização e planejamento da rotina profissional. Contribui para reduzir urgências, melhorar o cumprimento de prazos e aumentar a previsibilidade das entregas. Também fortalece a disciplina pessoal e a clareza sobre o que é realmente prioritário no dia a dia técnico.

Como se deve fazer:
1 Acessar o link do curso no Portal Sebrae
2 Realizar cadastro, se necessário
3 Concluir todos os módulos e atividades
4 Escolher pelo menos uma técnica aprendida no curso e aplicar na rotina, como matriz de priorização ou planejamento semanal estruturado
5 Utilizar a técnica por pelo menos 15 dias consecutivos
6 Registrar os impactos percebidos na organização, produtividade e cumprimento de prazos
7 Compartilhar os aprendizados com a liderança

Onde se pode fazer:
Portal Sebrae – Cursos Online

Como comprovar que fez:
Certificado de conclusão do curso + relatório simples descrevendo a técnica aplicada, período de uso e resultados percebidos, validado pela liderança",,1,,2026-02-26 16:43:54
1050012,900580,Título,Inteligência Emocional e Autoconhecimento,Inteligência Emocional e Autoconhecimento no Ambiente de Trabalho,,1,,2026-02-26 18:50:41
